{
  "$schema": "http://json-schema.org/draft-07/schema#",
  "title": "Fauna",
  "type": "object",
  "required": [
    "id",
    "type",
    "name",
    "clade"
  ],
  "properties": {
    "id": {
      "type": "string",
      "pattern": "^fauna_[a-z0-9_]+$"
    },
    "type": {
      "const": "fauna"
    },
    "name": {
      "type": "string"
    },
    "scientific": {
      "type": [
        "string",
        "null"
      ]
    },
    "clade": {
      "type": "string",
      "enum": [
        "mammal",
        "synapsid",
        "bird",
        "dinosaur",
        "crocodilian",
        "reptile",
        "amphibian",
        "fish",
        "insect",
        "arachnid",
        "crustacean",
        "mollusc",
        "cnidarian",
        "worm",
        "construct",
        "spectre"
      ],
      "description": "What kind of animal this is. The branch (vertebrate / invertebrate / unliving) and the amniote lineage (Synapsida / Diapsida) are read from database/clades.json rather than stored here, because they are properties of the group and not of the animal. Required: a species that does not say what it is sends the game back to guessing from its name, which is what this field exists to end."
    },
    "subclade": {
      "type": "string",
      "enum": [
        "avian_dinosaurid",
        "clay_born",
        "dromaeosaurid",
        "ember_born",
        "forest_born",
        "ratite",
        "sauropodomorph",
        "true_bird"
      ],
      "description": "A sub-group of the entity's own clade. The enum here is flat -- every subclade any clade declares -- because JSON Schema cannot express a dependency between two fields and would let a bird be a dromaeosaurid. `lint_story.py` adds the check that the subclade belongs to *that* clade, and that this list still matches what `clades.json` declares. The two live in different files and drifted the first time a clade gained sub-groups."
    },
    "taxonomy": {
      "type": "object"
    },
    "diet": {
      "type": "string",
      "enum": [
        "Carnivore",
        "Herbivore",
        "Omnivore",
        "Insectivore"
      ],
      "description": "Capitalised, because that is how canon writes it. Sparse -- 40 of 347 -- and not required."
    },
    "habitats": {
      "type": "array",
      "items": {
        "type": "string"
      }
    },
    "behaviour": {
      "type": "array",
      "items": {
        "type": "string"
      }
    },
    "related_species": {
      "type": "array",
      "items": {
        "type": "string"
      }
    },
    "base_species": {
      "type": "string",
      "description": "The animal this one was made from, where canon says so.\n\nDirectional, which is why it is not `related_species`: that field is a flat list of kin and says nothing about which came first. A wolf and an asura wolf are two species, and the asura wolf is the derived one. This records that.\n\nOnly for creatures canon states were taken from something. A maya-born construct has no base -- it was made rather than altered."
    },
    "notes": {
      "type": "string"
    },
    "canon": {
      "type": "string",
      "enum": [
        "primary",
        "secondary",
        "draft"
      ],
      "default": "primary"
    },
    "sources": {
      "type": "array",
      "items": {
        "type": "string"
      }
    },
    "journal_prompt": {
      "type": "string",
      "description": "Player-facing prose read in the travel journal. Distinct from `notes`: `notes` is a reference fact for the canon reader, `journal_prompt` is the sentence the player sees. Exported as `journalPrompt`."
    },
    "region": {
      "type": "string",
      "enum": [
        "saraswati-godavari-deltas",
        "narmada-vindhya",
        "gedrosian-taklamakan",
        "shattered-sea-mappa-mundi",
        "ganges-lava-sea",
        "tethys-sky-routes",
        "asura-conjurations",
        "prototype-starters",
        "aravali"
      ],
      "description": "Bestiary region of origin, kept for provenance."
    },
    "biomes": {
      "type": "array",
      "description": "Where this species lives, from the canonical vocabulary in database/biomes.json. Wider than the game's biome set on purpose: canon can say 'floating island' or 'Naraka rifts' even though the walk has nowhere to put them. The export keeps only the renderable ones, and a species left with none becomes placement 'lore' automatically. An empty list means nobody has tagged this yet -- say where it lives instead.",
      "items": {
        "type": "string",
        "enum": [
          "sea",
          "coast",
          "plains",
          "forest",
          "wetland",
          "hills",
          "mountains",
          "snow",
          "desert",
          "river",
          "settlement",
          "landmark",
          "sky_island",
          "sky_underside",
          "sky_water",
          "open_sky",
          "underworld",
          "lava_field"
        ]
      }
    },
    "placement": {
      "type": "string",
      "enum": [
        "encounter",
        "flavour",
        "lore"
      ],
      "description": "Whether the species can be met (`encounter`), only mentioned in passing (`flavour`), or exists in the record alone (`lore`)."
    },
    "rarity": {
      "type": "string",
      "enum": [
        "common",
        "rare",
        "mythic"
      ],
      "description": "How often a player meets one. Drives the weighting the game expands biome pools with, so a fourth value silently changes encounter rates."
    },
    "mood": {
      "type": "string",
      "enum": [
        "clever",
        "curious",
        "fearsome",
        "gentle",
        "graceful",
        "luminous",
        "mythic",
        "patient",
        "playful",
        "uncanny",
        "watchful"
      ],
      "description": "Drives journal tone. Fauna only."
    },
    "sentient": {
      "type": "boolean",
      "default": false,
      "description": "Taxonomic marker for the avian-dinosaurid and other sapient lineages (Cognitavi, Nagaraptor, Vajraptor, Silvanus, Sylvians, Kuktush). It records that a species is intelligent and socially organised -- see AI_CONTEXT.md:998-1006 -- and nothing more. It is NOT a placement rule: in-world the Harappans regard these as animals, so a sentient species sitting in the encounter table is correct, not an oversight."
    },
    "epochs": {
      "type": "array",
      "items": {
        "type": "string"
      },
      "description": "Epoch ids from database/timeline/epochs.json. Absent means present in all epochs."
    },
    "source_index": {
      "type": "integer",
      "minimum": 0,
      "description": "Position in the authored bestiary sequence (prototype starters first for fauna). Array order decides which species pickFor lands on for a tile, so this is part of the seed contract, not presentation."
    },
    "placement_note": {
      "type": "string",
      "description": "Why this species is placed as it is, when the answer is not obvious. Required reading before 'fixing' an entity with empty `biomes`: an empty list can mean untagged, or it can mean deliberately held out of play. If this field is present, the emptiness is a decision."
    },
    "crosses_at": {
      "type": "array",
      "items": {
        "type": "string"
      },
      "description": "Entity ids of the places where a species native to another realm enters this one. Naraka creatures cross at the Dwarka Gate (settlement_dwarka) rather than being native to delta water, so they should be met near a gate and nowhere else."
    },
    "aliases": {
      "type": "array",
      "items": {
        "type": "string"
      },
      "description": "Other names this creature is known by. Two fauna carry one, and neither schema nor linter knew until `additionalProperties` was tightened."
    },
    "appearance": {
      "type": "string",
      "minLength": 20,
      "description": "What it looks like, in prose a painter can work from: the body, colour and texture, not the pose. Canon's record for the books and the art plan; withheld from the game's bundle, which never reads it."
    },
    "landmasses": {
      "type": "array",
      "items": {
        "enum": [
          "jambhudweepa",
          "mainland_asia",
          "gondwana",
          "tethys"
        ]
      },
      "minItems": 1,
      "uniqueItems": true,
      "description": "Where it lives, by landmass. Absent means wherever its biomes are: most species cross freely. Present means only there -- the elephants and bears of Mainland Asia never stand on Jambhudweep, and Jambhudweep's relicts never cross north. The game places a species only on ground of a landmass it names."
    }
  },
  "additionalProperties": false
}
