{
  "id": "fauna_camelosuchus_calf",
  "type": "fauna",
  "name": "Camelosuchus Calf",
  "scientific": "Camelosuchus minor",
  "clade": "crocodilian",
  "region": "gedrosian-taklamakan",
  "biomes": [
    "desert"
  ],
  "placement": "encounter",
  "rarity": "common",
  "journal_prompt": "A young, playful camelosuchus that stays close to its mother, learning to forage on desert saltbush.",
  "canon": "primary",
  "sources": [
    "docs/bestiary.md",
    "docs/lore/lorework-2026-09-29.md"
  ],
  "mood": "playful",
  "source_index": 109,
  "landmasses": [
    "jambhudweepa",
    "gondwana"
  ]
}
