{
  "id": "fauna_abyssal_storm_watcher",
  "type": "fauna",
  "name": "Abyssal Storm-Watcher",
  "scientific": "Cognitavi abyssalis",
  "clade": "bird",
  "diet": "Omnivore",
  "habitats": [
    "coastal",
    "tethys"
  ],
  "behaviour": [
    "weather_reader",
    "solitary"
  ],
  "related_species": [
    "fauna_cognitavi"
  ],
  "notes": "Dark-winged Cognitavi that rides pressure fronts ahead of monsoon squalls. Sailors read its high circling as a storm warning.",
  "canon": "primary",
  "sources": [
    "SouthOfTethys.txt",
    "docs/bestiary.md",
    "docs/lore/lorework-2026-09-29.md"
  ],
  "region": "saraswati-godavari-deltas",
  "biomes": [
    "sea"
  ],
  "placement": "encounter",
  "rarity": "common",
  "journal_prompt": "A Cognitavi navigator bird subspecies that specializes in reading weather patterns, guiding wisdom-seekers and ships safely through the Tethys monsoons.",
  "mood": "clever",
  "sentient": true,
  "source_index": 16,
  "appearance": "A Cognitavi: raven-sized, with sleek, iridescent slate-grey plumage, an ivory casque above a sharp hooked beak and amber eyes flecked like stars. The storm-watcher is the dark-winged kind, its wings near-black against a squall sky."
}
