{
  "id": "fauna_glacial_wolf_spider",
  "type": "fauna",
  "name": "Glacial Wolf-Spider",
  "scientific": "Lycosa glacialis",
  "clade": "arachnid",
  "region": "ganges-lava-sea",
  "biomes": [
    "snow",
    "mountains"
  ],
  "placement": "encounter",
  "rarity": "rare",
  "journal_prompt": "A large, furry spider that hunts snow-hares and small rodents near the ice wall, its body containing high sugar-antifreeze.",
  "canon": "primary",
  "sources": [
    "docs/bestiary.md"
  ],
  "mood": "fearsome",
  "source_index": 164
}
