{
  "id": "fauna_colossal_void_devourer",
  "type": "fauna",
  "name": "Colossal Void-Devourer",
  "scientific": "Sauropodoligator titan",
  "clade": "dinosaur",
  "subclade": "sauropodomorph",
  "region": "asura-conjurations",
  "biomes": [
    "wetland",
    "river"
  ],
  "placement": "encounter",
  "rarity": "mythic",
  "journal_prompt": "An extinct sauropod-crocodile hybrid resurrected from buried bones via dark Asura magic, crowned with a cursed human visage.",
  "canon": "primary",
  "sources": [
    "docs/bestiary.md"
  ],
  "mood": "uncanny",
  "source_index": 206
}
