{
  "id": "fauna_floating_island_chameleon",
  "type": "fauna",
  "name": "Floating-Island Chameleon",
  "scientific": "Chamaeleo levitatus",
  "clade": "reptile",
  "region": "tethys-sky-routes",
  "biomes": [
    "sky_island"
  ],
  "placement": "encounter",
  "rarity": "rare",
  "journal_prompt": "A lizard that changes color to match the glowing moss, using its prehensile tail to hang from sky-mangrove roots.",
  "canon": "primary",
  "sources": [
    "docs/bestiary.md"
  ],
  "mood": "luminous",
  "source_index": 192,
  "placement_note": "Placeable since the sky tiles were painted. The earlier note held this as lore \"until a sky mode exists\" -- `sky_island` and `sky_underside` are renderable now, so the condition it named is met."
}
