{
  "id": "fauna_cliff_swift",
  "type": "fauna",
  "name": "Cliff Swift",
  "scientific": "Apus narmadae",
  "clade": "bird",
  "diet": "Insectivore",
  "habitats": [
    "region_narmada_plateau"
  ],
  "behaviour": [
    "aerial",
    "colony"
  ],
  "notes": "Fast insect-hunter of plateau cliffs. Nest density signals insect bloom years to highland herders.",
  "canon": "primary",
  "sources": [
    "SouthOfTethys.txt"
  ],
  "biomes": [
    "hills",
    "mountains",
    "plains"
  ],
  "placement": "encounter",
  "rarity": "common",
  "journal_prompt": "Swifts cut the air above the grass in long scything arcs, too fast to count.",
  "mood": "watchful",
  "source_index": 239
}
