{
  "id": "fauna_aero_moth",
  "type": "fauna",
  "name": "Aero-Moth",
  "scientific": "Lymantria caelia",
  "clade": "insect",
  "region": "tethys-sky-routes",
  "biomes": [
    "sky_island"
  ],
  "placement": "encounter",
  "rarity": "rare",
  "journal_prompt": "A large moth with soft, dusty wings patterned like grey clouds, drawing toward the glow of sky-brambles.",
  "canon": "primary",
  "sources": [
    "docs/bestiary.md"
  ],
  "mood": "luminous",
  "source_index": 191,
  "placement_note": "Placeable since the sky tiles were painted. The earlier note held this as lore \"until a sky mode exists\" -- `sky_island` and `sky_underside` are renderable now, so the condition it named is met."
}
