{
  "id": "fauna_frilled_shringasaurus",
  "type": "fauna",
  "name": "Frilled Shringasaurus",
  "scientific": "Shringasaurus torquatus",
  "clade": "reptile",
  "diet": "Herbivore",
  "habitats": [
    "region_narmada_plateau",
    "region_aravali"
  ],
  "behaviour": [
    "browsing",
    "solitary",
    "territorial"
  ],
  "related_species": [
    "fauna_shringasaurus"
  ],
  "notes": "The larger, later form of the same lineage: half again the length, with a bony frill spreading back from behind the horns over the neck. The frill is display and shade rather than armour -- it is thin enough to glow at the edges with the sun behind it, and old bulls carry it scarred. Where the common Shringasaurus moves in herds, these hold ground alone and do not give way to caravans.",
  "canon": "primary",
  "sources": [
    "SouthOfTethys.txt",
    "docs/lore/lorework-2026-09-29.md"
  ],
  "biomes": [
    "plains",
    "hills",
    "mountains"
  ],
  "placement": "encounter",
  "rarity": "rare",
  "journal_prompt": "It does not move aside. The frill turns first, edge-on and then full, thin enough that the low sun comes through it in red, and the horns beneath it are the same shape as the smaller kind's and twice the size.",
  "mood": "fearsome",
  "region": "narmada-vindhya",
  "source_index": 245,
  "landmasses": [
    "jambhudweepa",
    "gondwana"
  ]
}
