{
  "id": "fauna_scutosaurus_shield_beast",
  "type": "fauna",
  "name": "Scutosaurus Shield-Beast",
  "scientific": "Scutosaurus asuricus",
  "clade": "reptile",
  "region": "asura-conjurations",
  "biomes": [
    "plains",
    "hills"
  ],
  "placement": "encounter",
  "rarity": "mythic",
  "journal_prompt": "A massive, bone-plated pareiasaur. The Asura bred its line as living shield-walls tens of millions of years ago; now it grazes feral by old earthworks, or hauls stone for whoever has tamed it.",
  "canon": "primary",
  "sources": [
    "docs/bestiary.md",
    "docs/lore/lorework-2026-09-29.md"
  ],
  "mood": "watchful",
  "source_index": 223,
  "appearance": "A Permian pareiasaur: a massive, low, barrel-bodied herbivore covered in bony plates, often wearing weathered leather and brass harness from the work it is put to now."
}
