{
  "id": "fauna_sky_faring_grasshopper",
  "type": "fauna",
  "name": "Sky-Faring Grasshopper",
  "scientific": "Melanoplus caelius",
  "clade": "insect",
  "region": "saraswati-godavari-deltas",
  "biomes": [
    "sky_island",
    "open_sky"
  ],
  "placement": "lore",
  "rarity": "common",
  "journal_prompt": "A lightweight, gas-buoyant grasshopper that migrates between floating islands, feeding on sky-bramble leaves.",
  "canon": "primary",
  "sources": [
    "docs/bestiary.md"
  ],
  "mood": "graceful",
  "source_index": 55,
  "placement_note": "Lives on the floating islands. `sky_island` and its neighbours are real canon biomes but are not renderable yet, so the export holds this as lore until a sky mode exists. This is a stated home, not an untagged entity."
}
